000001.wav|Рашааны орой сэрүүн салхи үлээж, саруул шөнө тэнгэрт асар олон од
000002.wav|Сургуулийн сурагчид спортын заланд цуглаж
000003.wav|Биеийн тамирын дасгалаа хийж эхлэхдээ амжилт гаргахын төлөө
000004.wav|Ресторан руу алхаж явахдаа сургуулийн багштай таарч сонирхолтой сэдвээр ярилцан
000005.wav|Сэрүүн борооны дараа сарнай цэцэгсийн анхилуун үнэр
000006.wav|Радарын тусламжтайгаар сансрын хөлөг аюулгүйгээр газардсан тухай
000007.wav|Саруул өрөөнд нарны туяа
000008.wav|Саруул өрөөнд нарны туяа цонхоор тусаж
000009.wav|Тэндээс нь рояал төгөлдөр хуур дээр
000010.wav|Ренценгийн зохион байгуулсан сургалтад сурагчид
000011.wav|Ренценгийн зохион байгуулсан сургалтад суралцагчид сонирхолтой илтгэлүүд сонсож
000012.wav|Шинэ мэдлэгээ амьдралд хэрэгжүүлэх
000013.wav|Сэрүүн өглөөний цагаар саруулхан гудамжинд хүмүүсийн хөл хөдөлгөөн эрчимтэй болж
000014.wav|Ромбо хэлбэртэй цонхны цаанаас сэрүү татсан борооны чимээ сонсогдож
000015.wav|Шөнө дөлөөр намуухан аяз тоглох мэт
000016.wav|Санах ойдоо хадгалсан бүхэн рояал төгөлдөр хуурын аялгуугаар амилж
000017.wav|Сэтгэлийн гүн дэх мэдрэмжүүд
000018.wav|Сарны гэрэлд гялалзах чулуунууд сансрын онгоцны сүүдэрт туссан туяа хоёрыг харж байсан эрдэмтэн
000019.wav|Робот инженерүүдийн хийсэн шинэ төхөөрөмж нь сансар огторгуйд хэрэглэгдэх зориулттай бөгөөд
000020.wav|Сургуулийн сурагчид багш нар болон эцэг эхчүүд хамтдаа сагсан бөмбөгийн талбай дээр сонирхолтой тэмцээнийг
000021.wav|Сайхан амьдрахын тулд сэтгэл зүрхээ зориулан хичээж
000022.wav|роботуудын оролцоотой үйлдвэрийн салбарууд хурдан хөгжиж
000023.wav|Саруулхан шөнө салхины сэрүүн мэдрэмж сарны туяаг даган урсах голын усны чимээгүүд
000024.wav|Гайхалтай тайван санагдана.
000025.wav|Ресторанд үйлчлүүлэхэд ажилчид үйлчилгээгээ сайжруулж
000026.wav|Үйлчлүүлэгчдийн сэтгэл ханамжийг
000027.wav|өндөр түвшинд хүргэхийг хичээдэг.
000028.wav|Сонирхолтой зохиол бичихийн тулд судалгаа хийж зохиолчийн санаагаа
000029.wav|Сүүлийн жилүүдэд санхүүгийн зах зээл томоохон өөрчлөлтүүд гарч хөрөнгө оруулалтын сонирхолтой боломжууд.
000030.wav|робот техник болон хиймэл оюун ухааны салбарын шинэчлэл хүн төрөлхтний ирээдүйд
000031.wav|маш ихээр нөлөөлнө гэж.
000032.wav|Сарны туяа цонхны шилэн дээр тусч
000033.wav|Сарны туяа цонхны шилэн дээр тусч өрөөг бүрэн гэгээтэй болгох нь.
000034.wav|Сургалтын төвд оюутнууд дата анализ хийх код бичих цаг.
000035.wav|Сургалтын төвд оюутнууд дата анализ хийх
000036.wav|Код бичих чадвараа сайжруулах хөтөлбөрт
000037.wav|Шинэ бүтээгдэхүүн зах зээлд гарсны дараа хэрэглэгчдийн хандалт нэмэгдэж
000038.wav|Компьютерийн лабораторт оюутнууд шинэ технологийг судалж дадлага ажлынхаа үр дүнг
000039.wav|Хотын шинэ төвд баригдсан оффисын барилга.
000040.wav|Орчин үеийн дэд бүтэцтэй ухаалаг технологийг
000041.wav|Хүүхдүүдийн сургалтад VR технологи ашигласнаар тэдний суралцах идэвх нэмэгдэж
000042.wav|Дэлхийн стартап форумд Монголын баг оролцож инновацилаг шийдлээ танилцуулсан нь.
000043.wav|Оюутнууд шинэ төслийн талаар багш нартайгаа хамтран ажиллаж
000044.wav|Хурлын үеэр шинэ технологуудын талаар илтгэгчид персентац хийж.
000045.wav|Хурлын үеэр шинэ технологуудын талаар илтгэгчид персентац хийж.
000046.wav|веб сайтын хөгжүүлэлтэд оролцсон баг SEO сайжруулалт хийж
000047.wav|веб сайтын хөгжүүлэлтэд оролцсон баг SEO сайжруулалт хийж
000048.wav|Вебсайтын хүүчүү лалтай тавраалтсан байг сиү сээжээрүү лалтээж.
000049.wav|Сурталчилгааны стратеги төлөвлөгөө гаргасан баг шинэ флатформ ашиглан.
000050.wav|Бизнес инкобатор залуу энтрепионаруудыг дэмжих
000051.wav|Шинэ хөтөлбөр эхлүүлсэн нь
000052.wav|Компьютерийн лабораторт багш нар оюутнуудад эй-ай технологийн талаарх мэдлэгээ хуваалцаж.
000053.wav|Дотоодын стартап компани сошиал медиа платформ
000054.wav|Дотоодын стартап компани сошиал медиа платформоор дамжуулан
000055.wav|Виртуал бодит байдалд суурилсан сургалтын платфорууд оюутнуудад хичээлийн туршлагын илүү сонирхолтай болгож байна.
000056.wav|Бизнесийн шинэ модель ашигласнаар компаний бүтээмж нэмэгдэж
000057.wav|Бизнесийн шинэ модель ашигласнаар компаний бүтээмж нэмэгдэж
000058.wav|Зочид буудлын үйлчилгээг сайжруулахын тулд автоматжуулсан систем
000059.wav|Маркетингийн баг контент хөгжүүлэлтээ дижитал платформд шилжүүлсэнээр хандалтын
000060.wav|Сошиал медиа хэрэглэгчид шинэ апплейкшины талаар эерэг сэтгэгдэл үлдээж
000061.wav|технологийн багийнхан шинэчлэлт хийхийн тулд дата анализ хийж
000062.wav|Программ хангамжийн хөгжүүлэгчид автоматжуулалтын шинэ софтвээр боловсруулж
000063.wav|Хотын төвд зохион байгуулсан олон улсын форумд технологийн дэвшил
000064.wav|инновацийн талаар хэлэлцлээ.
000065.wav|Шинэ стартап компани дижитал платформ ашиглан хэрэглэгчдийн датагаа хамгаалах
000066.wav|Роботын тусламжтайгаар сансарын станц дахь засварын ажил
000067.wav|Сургуулийн сурагчид сарны тухай судалгааны ажлаа
000068.wav|Сайхан амьдралын гол түлхүүр бол
000069.wav|Роботуудыг ашиглалт олон салбарт өргөжиж
000070.wav|Салхины хүчтэй улиралд сэргээгдэх эрчим хүчний хэрэглээ
000071.wav|рестораны амтат хоолнуудын жорыг шинээр нэмж
000072.wav|Сарны гэгээнд найзуудтайгаа зугаалж эртний соёлын тухай ярилцах
000073.wav|Сурагчид багшийнхаа удирдлага дор шинэ программчлалын хичээл хийнэ
000074.wav|Сэтгэлийн тэнхээгээ алдалгүй зорилгоо тодорхойлон урагшлах нь
000075.wav|Робот техникийн олимпиадад оролцсон сурагчид медал хүртэж
000076.wav|Салхины эрч хүчийг ашиглан эрчим хүч үйлдвэрлэх шинэ технологийг
000077.wav|Сарны зурагтай номын хавтас хүүхдүүдийн сонирхлыг
000078.wav|Робот гар урлалын бүтээлүүдийг нарийн хийцтэйгээр боловсруулах
000079.wav|гар урлалын бүтээлүүдийг нарийн хийцтэйгээр боловсруулах
000080.wav|Сайн сурагчид хичээлээс гадуур үйл ажиллагаанд
000081.wav|Сарны туяа усны гадарга дээр тусч гялалзах нь
000082.wav|Роботуудыг хөдөө аж ахуйн салбарт өргөнөөр ашиглах боломжтой болсон
000083.wav|Сонирхолтой тоглоомын дүрэмтэй уралдаан сурагчдын бүтээлч сэтгэлгээг
000084.wav|Хүмүүс зорилгодоо хүрэхийн тулд өөрийгөө удирдахыг
000085.wav|Робот туслагчийг ашиглан өвснүүдийг нарийн оношлох ажилд
000086.wav|Сарны нөлөө далайн түрлэгийг өөрчилж эргийн шугамыг
000087.wav|Робот гарын үйлдлийг хүнийхтэй ойролцоо хийх
000088.wav|Сургууль зохион байгуулсан спортын тэмцээн сурагчдын эв нэгдлийг
000089.wav|Сайн судалгаа хийхийн тулд шинжлэх ухааны мэдээллийн санг
000090.wav|Робот, техникийн сургалтын төвд хүүхдүүд шинэ мэдлэг эзэмшиж байна
000091.wav|Сарны туяаг шөнөжингөө ажиглаж
000092.wav|Сарны туяаг шөнөжингөө ажиглаж
000093.wav|Түүний хөдөлгөөнийг тэмдэглэх ажил
000094.wav|Сансарын аялалд зориулагдсан шинэ хөлгийг дэлхий нийтэд
000095.wav|Роботуудын тусламжтайгаар агуулах дах бараа материалын хяналтыг
000096.wav|Сэтгэл судлалын хичээлд оролцох нь хүний сэтгэл зүйн хөгжилд
000097.wav|Сарны зурагт ном бичсэн зохиолчид шагнал
000098.wav|Сарны зурагт ном бичсэн
000099.wav|Сарны зурагт ном бичсэн зохиолчид
000100.wav|Роботын тусламжтайгаар барилга угсралтын ажлыг
000101.wav|Сансарын хөлгийн бүрэн ажиллагааг шалгах туршилтыг амжилттай дуусгасан байна
000102.wav|Сарны туяа ойж эргийн шугамыг нарийн тодорхойлох боломжийг
000103.wav|Робот гар бүтээх технологийг дээд түвшинд
000104.wav|Сайхан харилцаа үүсгэхийн тулд бусдын санаа бодлыг
000105.wav|Сургуулийн багш нар сурагчдын амжилтанд дэмжлэг үзүүлэхийн тулд шинэ аргуудыг
000106.wav|Салхины хүчийг ашиглан цахилгаан үйлдвэрлэх нь
000107.wav|робото техник болон хиймэл оюун ухааны салбар шинэ эрин үеийг
000108.wav|Сарны зураг төсөл боловсруулахад инженерүүдийн ур чадвар
000109.wav|Робот гарын хөдөлгөөнийг сайжруулах
000110.wav|Робот гарын хөдөлгөөнийг сайжруулах технологийг хөгжүүлэх ажилд олон судлаачид
000111.wav|Сонирхолтой түүхүүдийг сонсох нь хүний төсөөллийг баяжуулж
000112.wav|Сургуулийн сурагчид багийн ажилд оролцсоноор өөрсдийн ур чадвараа
000113.wav|Сарны хөдөлгөөн болон түүнд нөлөөлдөг хүчин зүйлсийг судлах ажил
000114.wav|Робот гарын тусламжтайгаар нарийн мэс заслыг гүйцэтгэх боломжтой болсон байна.
000115.wav|Робот гарын тусламжтайгаар нарийн мэс заслыг гүйцэтгэх
000116.wav|Сургууль дээрх спортын тэмцээн сурагчдын уралдааныг сонирхолтой болгодог.
000117.wav|Сайхан харилцаа үүсгэхийн тулд өөрийн сэтгэл санаагаа зөв илэрхийлэх хэрэгтэй.
000118.wav|Робот хөлөг онгоцнуудыг үйлдвэрлэх ажлыг цоо шинэ түвшинд гаргалаа.
000119.wav|Сарны гэрэлд гялалзах далайн давалгааг харах нь хүний сэтгэлийг баясгадаг.
000120.wav|Сансарын судалгааны баг шинэ нээлтүүдийг дэлхий нийтэд
000121.wav|Робот ашиглан үйлдвэрлэлийн нарийн ажлыг хөнгөвчилөх шийдлүүдийг
000122.wav|Робот судлаачид шинэ төрлийн программчлалын аргачлал боловсруулахад
000123.wav|Рестораны ажилтнууд эрч хүчтэй үйлчлүүлэгчүүдийг угтаж
000124.wav|үйлчилгээний чанарыг сайжруулахыг хичээдэг.
000125.wav|Реклам сурталчилгааны зах зээлд өрсөлдөх чадвараа дээшлүүлэх нь чухал
000126.wav|Резинэн бөмбөг ашиглан хүүхдүүдийн тоглох талбайг
000127.wav|Роман унших нь сэтгэлийн амар амгаланг олох
000128.wav|Рекорд эвдсэн тамирчин олон хүний бахархлыг
000129.wav|Рестораны амтат хоолны жорыг нарийвчлан тэмдэглэж
000130.wav|Резинус үүсгэх технологи эрчим хүчний салбарт шинэчлэл авчирна.
000131.wav|Ретро стилийн хувцаслалт нь өнөөгийн залуусын
000132.wav|Роботын программчлалд гарсан алдаа
000133.wav|Рекламд ашигласан зураг төслийн бүтээгдэхүүний борлуултад
000134.wav|Ресторануудын хоолны амт чанарыг хэрэглэгчид
000135.wav|Резининг эдлэлүүд нь аюулгүй байдалд
000136.wav|Резюмээ сайжруулахын тулд мэргэжлийн зөвлөмжийг
000137.wav|Рекордыг эвдсэн тамирчны ялалтыг өргөн дэлгэр
000138.wav|Романтик үдэшлэг зохион байгуулах нь хүмүүсийн сэтгэлийг
000139.wav|Роботын нарийн үйлдлийг сайжруулах судалгаа үр дүнтэй болжээ.
000140.wav|Рекламын агуулгыг зорилтот хэрэглэгчдэд хүргэх нь
000141.wav|Резинийн тууз ашиглан шинэ төрлийн угсралтын технологийг
000142.wav|Реклам сурталчилгааны бүтээлч санаа борлуулалтыг нэмэгдүүлж чаддаг.
000143.wav|Ресторануудын уралдаан идэвхтэй өрнөж.
000144.wav|Резинансын эффектийг ашиглан үйлдвэрлэлийн салбарт шинэчлэл хийв.
000145.wav|Резинансын эффектийг ашиглан үйлдвэрлэлийн салбарт шинэчлэл хийв.
000146.wav|Робот техник эрүүл мэндийн салбарт.
000147.wav|Роман бичихдээ зохиолчид сэтгэл хөдлөлийг тодорхой дүрсэлдэг.
000148.wav|Реклам сурталчилгааны салбарын өрсөлдөөн нэмэгдэж байна.
000149.wav|Резин бэлдэхдээ албан ёсны загварыг
000150.wav|Робот гаргаж буй бүтээгдэхүүний
000151.wav|Ресторанууд хоорондоо өрсөлдөж үйлчилгээний төвшинг
000152.wav|Резонансийн технологи эрчим хүчний үйлдвэрлэлд
000153.wav|шинэ боломжуудыг нээж байна.
000154.wav|Рекорд эвдэхийг хүссэн тамирчин хичээл зүтгэл гарган
000155.wav|Рекорд эвдэхийг хүссэн тамирчин хичээл зүтгэл гарган бэлтгэл хийжээ
000156.wav|Романтик кинонуудыг үзэх нь хүмүүсийн сэтгэлийн амар амгаланг нэмэгдүүлдэг.
000157.wav|Роботууд хүний хөдөлмөрийг хөнгөвчилж үйлдвэрлэлийн үр ашгийг
000158.wav|Рекламын стратегийг сайтар боловсруулсан компани
000159.wav|Резинэн эдлэл үйлдвэрлэх салбар
000160.wav|Ресторануудын үйлчлэгчдийн харилцаа үйлчлүүлэгчдийн сэтгэл ханамжид
000161.wav|Робот гарын хөдөлгөөн хүний гарыг орлохуйц
000162.wav|Рекламны чанар бүтээгдэхүүний нэр хүндэд
000163.wav|Резонансийн үзэгдлийг ашиглах технологийг олон салбар
000164.wav|Роботууд үйлдвэрлэлийн бүх үе шатанд оролцох чадвартай болжээ.
000165.wav|Рекорд эвдсэн тамирчин шагнал гардаж гэр бүлээ
000166.wav|Роман бичихэд хэрэглэгддэг түүхэн баримтууд
000167.wav|Робот техник сурагчдын шинжлэх ухаанд
000168.wav|сурагчдын шинжлэх ухаанд сонирхлыг
000169.wav|Ресторанууд амт чанарыг илүү сайжруулах арга замуудыг
000170.wav|Резин дээрх мэдээллийг үнэн зөвөөр орлуулах нь
000171.wav|Резин дээрх мэдээллийг үнэн зөвөөр орлуулах нь чухал.
000172.wav|Реклам үзэгчдийн анхаарлыг татахуйц байх ёстой.
000173.wav|Робот программчиллын сургалтад суралцагчид ирээдүйн ажлын байранд бэлтгэгдэж байна
000174.wav|Резинансын онолыг ашиглан хөгжүүлсэн шинэ төхөөрөмж.
000175.wav|Ресторануудын хоолны цэс үйлчлүүлэгчдийн сонирхлыг татахуйц
000176.wav|Роботын үйл ажиллагааг хянах программ хангамжийг
000177.wav|Резинэн бүтээгдэхүүний чанар хүний өдөр тутмын хэрэглээнд
000178.wav|Монгол улсын улс төрийн нөхцөл байдлын талаарх ерөнхий зураглал
000179.wav|Монгол улс ардчилалд шилжсэнээс улс төрийн системд эрх зүйн орчин
000180.wav|Ардчилсан тогтолцооний үндсэн тулгуур нь үндсэн хууль бөгөөд энэ нь иргэдийн эрх, эрх чөлөөг хамгаалах.
000181.wav|Сүүлийн жилүүдэд Монголын улс төрийн байдал хэд хэдэн гол асуудал
000182.wav|Сүүлийн жилүүдэд Монголын улс төрийн байдалд хэд хэдэн гол асуудал онцгой анхаарал татаж байна.
000183.wav|Монгол улсад улс төрийн намууд сонгуулийн үйл явцад гол үүрэг гүйцэтгэдэг.
000184.wav|Санхүүжилтийн ил тод байдал
000185.wav|олон нийтийн шүүмжлэл дагуулдаг.
000186.wav|Улс төрийн намууд илүү тогтвортой шударга ардчилсан зарчимд суурилсан бүтэцтэй болох.
000187.wav|Засаглалын хяналт хариуцлага
000188.wav|Төрийн байгууллагуудын үйл ажиллагааны ил тод байдал.
000189.wav|Төрийн байгууллагуудын үйл ажиллагааны ил тод байдал.
000190.wav|хариуцлага хангалтгүй байгаа нь иргэдийн итгэлийг
000191.wav|Улс төрийн албан тушаалтнуудын авлига
000192.wav|Шийдвэр гаргах процессын бодитой байдал.
000193.wav|Орон нутгийн өөрөө удирдах байгууллагуудын эрх мэдэл санхүүгийн бие даасан байдал хязгаарлагдмал байгаа.
000194.wav|Орон нутгийн иргэдийн оролцоог нэмэгдүүлэх замаар нутгийн засаглалын үр өгөөжийг
000195.wav|Иргэний оролцоо итгэл
000196.wav|Иргэдийн улс төрийн оролцоо сул.
000197.wav|Сонгуулийн ирц буурч байгаа нь ноцтой асуудал юм.
000198.wav|Иргэд улс төрийн шийдвэр гаргалтад оролцох санаа бодлоо
000199.wav|Иргэдийн улс төрийн оролцоо сул.
000200.wav|Иргэд улс төрийн шийдвэр гаргалтад оролцох
000201.wav|санал бодлоо чөлөөтэй илэрхийлэх боломжийг бүрдүүлэх нь
000202.wav|Эдийн засгийн сорилт ба улс төрийн шийдвэрүүд
000203.wav|Монгол улсын эдийн засгийн тулгамдсан асуудлууд тухайлбал уул уурхайн салбарын үр ашигтай ашиглалт
000204.wav|Үрийн удирдлага зэргээс улс төрийн шийдвэр гаргалт
000205.wav|Эдийн засгийн тогтвортой байдлыг хангахын тулд урт хугацааны стратегийн бодлого боловсруулах
000206.wav|Монгол улсын улс төрийн тогтолцоо нь хөгжлийнхөө эхний үе шатанд байгаа боловч
000207.wav|Шударга ёсны зарчмуудыг сайжруулах шаардлагатай хэвээр байна.
000208.wav|Иргэн төвтэй, хариуцлагатай засаглал тогтоохын тулд улс төрийн намууд
000209.wav|Иргэний нийгмийн байгууллагууд хамтран ажиллах нь
000210.wav|Өвлийн хүйтэн өглөөний тунгалаг агаарт амьсгалах бүрийг
000211.wav|түүнийг амьдралын гүн утга учрыг эргэцүүлэхэд хүргэнэ.
000212.wav|Өвлийн хүйтэн өглөөний тунгалаг агаарт амьсгалах бүрийг цан уур болж харагдах нь
000213.wav|түүнийг амьдралын гүн утга учрыг эргэцүүлэхэд хүргэнэ.
000214.wav|Хурц нартай өдрийн туяа цэцэрлэгийн өнгө өнгийн цэцгүүд дээр тусах нь
000215.wav|Түүний сэтгэлийн нууцлаг хөндүүрийг нэгэн хором мартагдуулах шиг болов.
000216.wav|Шөнийн нам гүмд цонхон доорх модны навч үл мэдрэг чичрэхэд
000217.wav|түүний доторх уйтгар гуниг үл мэдэгдэх гүнээс өндийж мэт
000218.wav|Шөнийн нам гүмд цонхон доорх модны навч үл мэдрэг чичрэхэд
000219.wav|Шөнийн нам гүмд цонхон доорх модны навч үл мэдрэг чичрэхэд
000220.wav|түүний доторх уйтгар гуниг үл мэдэгдэх гүнээс
000221.wav|Бороотой өдрийн эхний дусал хацар дээр нь зөөлөн хүрэхэд
